{
  "event_id": "evt_01H8TESTINTENTENDORSED0000",
  "tenant_id": "ten_local",
  "room_id": "room_01H8TESTROOM00000000000000",
  "thread_id": "thr_01H8TESTTHREAD00000000000",
  "discussion_epoch_id": "epoch_01H8TESTEPOCH0000000000",
  "seq": 151,
  "type": "intent.endorsed",
  "schema_version": 1,
  "occurred_at": "2026-08-25T10:00:02.000Z",
  "actor": { "participant_id": "par_owner", "kind": "human" },
  "causation_id": null,
  "correlation_id": "rnd_01H8TESTROUND00000000000",
  "visibility": { "kind": "public" },
  "payload": {
    "intent_id": "int_01H8TESTINTENT0000000000",
    "endorsed_by": "par_owner",
    "effect": "grant"
  },
  "metadata": {}
}
