{
  "event_id": "evt_roomdeleted01",
  "tenant_id": "ten_local",
  "room_id": "room_fixture01",
  "thread_id": null,
  "discussion_epoch_id": null,
  "seq": 110,
  "type": "room.deleted",
  "schema_version": 1,
  "occurred_at": "2026-09-02T04:00:00.000Z",
  "actor": {
    "participant_id": "par_owner",
    "kind": "human"
  },
  "causation_id": null,
  "correlation_id": null,
  "visibility": {
    "kind": "public"
  },
  "metadata": {},
  "payload": {
    "room_id": "room_fixture01",
    "reason": "测试后清理"
  }
}
