{
  "event_id": "evt_01H8TESTDOCATTACHED000000000",
  "tenant_id": "ten_local",
  "room_id": "room_01H8TESTROOM00000000000000",
  "thread_id": null,
  "discussion_epoch_id": null,
  "seq": 160,
  "type": "doc.attached_to_room",
  "schema_version": 1,
  "occurred_at": "2026-09-16T10:10:00.000Z",
  "actor": { "participant_id": "par_01H8TESTOWNER00000000000", "kind": "human" },
  "causation_id": null,
  "correlation_id": null,
  "visibility": { "kind": "public" },
  "payload": {
    "doc_id": "doc_0123456789ab",
    "attached_by": "par_01H8TESTOWNER00000000000"
  },
  "metadata": {}
}
