{
  "event_id": "evt_01H8TESTROUNDOPENAUTO000001",
  "tenant_id": "ten_local",
  "room_id": "room_01H8TESTROOM00000000000000",
  "thread_id": null,
  "discussion_epoch_id": "epoch_01H8TESTEPOCH0000000000",
  "seq": 214,
  "type": "round.opened",
  "schema_version": 1,
  "occurred_at": "2026-09-01T10:00:02.000Z",
  "actor": { "participant_id": "par_system", "kind": "system" },
  "causation_id": "evt_01H8TESTAGENTMSG000000001",
  "correlation_id": "rnd_01H8TESTROUNDAUTO0000001",
  "visibility": { "kind": "public" },
  "payload": {
    "round_id": "rnd_01H8TESTROUNDAUTO0000001",
    "stimulus_event_id": "evt_01H8TESTAGENTMSG000000001",
    "mode": "open_floor",
    "reveal_strategy": "simultaneous",
    "intent_window": "20s",
    "policy_version": "pol_1",
    "auto_index": 1
  },
  "metadata": {}
}
