{
  "event_id": "evt_01H8TESTMESSAGE0000000000001",
  "tenant_id": "ten_local",
  "room_id": "room_01H8TESTROOM00000000000000",
  "thread_id": "thr_01H8TESTTHREAD00000000000",
  "discussion_epoch_id": "epoch_01H8TESTEPOCH0000000000",
  "seq": 150,
  "type": "message.posted",
  "schema_version": 1,
  "occurred_at": "2026-08-25T10:01:00.123Z",
  "actor": { "participant_id": "par_01H8TESTOWNER0000000000", "kind": "human" },
  "causation_id": null,
  "correlation_id": null,
  "visibility": { "kind": "public" },
  "payload": {
    "body": "fixture: 带类型化关系的人类发言",
    "reply_to": null,
    "addressed_to": ["par_01H8TESTAGENT0000000000"],
    "relations": [
      { "target_event_id": "evt_01H8TESTMESSAGE0000000000000", "kind": "challenges", "provenance": "explicit" },
      { "target_event_id": "evt_01H8TESTSTIMULUS000000000", "kind": "extends", "provenance": "explicit" }
    ],
    "thread_id": null
  },
  "metadata": {}
}
